2025-11-28 22:51:44,197 - INFO - Using device: cuda
2025-11-28 22:51:44,197 - INFO - Log file: /home/yajat/Documents/DIP/Deep-Retinex-Decomposition-Extension/logs/training_20251128_225144.log
2025-11-28 22:51:44,349 - INFO - Model initialized with 555,205 parameters
2025-11-28 22:51:44,356 - INFO - 
Starting training...
2025-11-28 22:51:44,356 - INFO - Total epochs: 100
2025-11-28 22:51:44,356 - INFO - Batch size: 8
2025-11-28 22:51:44,356 - INFO - Learning rate: 0.001
2025-11-28 22:51:44,356 - INFO - Patch size: 48
2025-11-28 22:51:44,357 - INFO - Training samples: 689
2025-11-28 22:51:44,357 - INFO - Validation samples: 100
2025-11-28 22:51:55,473 - INFO - Epoch 1/100 - Train Loss: 0.4188, Val Loss: 0.2525, LR: 0.001000
2025-11-28 22:51:55,499 - INFO - New best model saved! Val Loss: 0.2525
2025-11-28 22:52:05,612 - INFO - Epoch 2/100 - Train Loss: 0.3240, Val Loss: 0.2302, LR: 0.001000
2025-11-28 22:52:05,635 - INFO - New best model saved! Val Loss: 0.2302
2025-11-28 22:52:15,245 - INFO - Epoch 3/100 - Train Loss: 0.2937, Val Loss: 0.2322, LR: 0.001000
2025-11-28 22:52:24,733 - INFO - Epoch 4/100 - Train Loss: 0.2916, Val Loss: 0.2151, LR: 0.001000
2025-11-28 22:52:24,758 - INFO - New best model saved! Val Loss: 0.2151
2025-11-28 22:52:34,263 - INFO - Epoch 5/100 - Train Loss: 0.2852, Val Loss: 0.3305, LR: 0.001000
2025-11-28 22:52:44,372 - INFO - Epoch 6/100 - Train Loss: 0.2841, Val Loss: 0.2288, LR: 0.001000
2025-11-28 22:52:54,618 - INFO - Epoch 7/100 - Train Loss: 0.2920, Val Loss: 0.2242, LR: 0.001000
2025-11-28 22:53:04,846 - INFO - Epoch 8/100 - Train Loss: 0.2720, Val Loss: 0.2146, LR: 0.001000
2025-11-28 22:53:04,873 - INFO - New best model saved! Val Loss: 0.2146
2025-11-28 22:53:15,100 - INFO - Epoch 9/100 - Train Loss: 0.2829, Val Loss: 0.2504, LR: 0.001000
2025-11-28 22:53:24,859 - INFO - Epoch 10/100 - Train Loss: 0.2667, Val Loss: 0.3003, LR: 0.001000
2025-11-28 22:53:34,556 - INFO - Epoch 11/100 - Train Loss: 0.2593, Val Loss: 0.1904, LR: 0.001000
2025-11-28 22:53:34,576 - INFO - New best model saved! Val Loss: 0.1904
2025-11-28 22:53:44,215 - INFO - Epoch 12/100 - Train Loss: 0.2487, Val Loss: 0.2041, LR: 0.001000
2025-11-28 22:53:53,989 - INFO - Epoch 13/100 - Train Loss: 0.2578, Val Loss: 0.2271, LR: 0.001000
2025-11-28 22:54:03,774 - INFO - Epoch 14/100 - Train Loss: 0.2438, Val Loss: 0.1928, LR: 0.001000
2025-11-28 22:54:13,660 - INFO - Epoch 15/100 - Train Loss: 0.2487, Val Loss: 0.2167, LR: 0.001000
2025-11-28 22:54:23,774 - INFO - Epoch 16/100 - Train Loss: 0.2468, Val Loss: 0.2124, LR: 0.001000
2025-11-28 22:54:33,384 - INFO - Epoch 17/100 - Train Loss: 0.2434, Val Loss: 0.2395, LR: 0.001000
2025-11-28 22:54:43,821 - INFO - Epoch 18/100 - Train Loss: 0.2405, Val Loss: 0.1957, LR: 0.001000
2025-11-28 22:54:54,147 - INFO - Epoch 19/100 - Train Loss: 0.2330, Val Loss: 0.2031, LR: 0.001000
2025-11-28 22:55:04,500 - INFO - Epoch 20/100 - Train Loss: 0.2347, Val Loss: 0.2516, LR: 0.001000
2025-11-28 22:55:14,868 - INFO - Epoch 21/100 - Train Loss: 0.2240, Val Loss: 0.2070, LR: 0.001000
2025-11-28 22:55:25,346 - INFO - Epoch 22/100 - Train Loss: 0.2352, Val Loss: 0.2257, LR: 0.001000
2025-11-28 22:55:35,673 - INFO - Epoch 23/100 - Train Loss: 0.2192, Val Loss: 0.2313, LR: 0.001000
2025-11-28 22:55:45,426 - INFO - Epoch 24/100 - Train Loss: 0.2185, Val Loss: 0.2151, LR: 0.001000
2025-11-28 22:55:55,162 - INFO - Epoch 25/100 - Train Loss: 0.2236, Val Loss: 0.1901, LR: 0.001000
2025-11-28 22:55:55,189 - INFO - New best model saved! Val Loss: 0.1901
2025-11-28 22:56:04,921 - INFO - Epoch 26/100 - Train Loss: 0.2068, Val Loss: 0.1650, LR: 0.001000
2025-11-28 22:56:04,943 - INFO - New best model saved! Val Loss: 0.1650
2025-11-28 22:56:14,716 - INFO - Epoch 27/100 - Train Loss: 0.2183, Val Loss: 0.1980, LR: 0.001000
2025-11-28 22:56:24,546 - INFO - Epoch 28/100 - Train Loss: 0.2153, Val Loss: 0.1840, LR: 0.001000
2025-11-28 22:56:34,478 - INFO - Epoch 29/100 - Train Loss: 0.2087, Val Loss: 0.2111, LR: 0.001000
2025-11-28 22:56:44,249 - INFO - Epoch 30/100 - Train Loss: 0.2065, Val Loss: 0.2002, LR: 0.001000
2025-11-28 22:56:54,020 - INFO - Epoch 31/100 - Train Loss: 0.2088, Val Loss: 0.1879, LR: 0.001000
2025-11-28 22:57:03,801 - INFO - Epoch 32/100 - Train Loss: 0.2028, Val Loss: 0.2092, LR: 0.001000
2025-11-28 22:57:13,623 - INFO - Epoch 33/100 - Train Loss: 0.2006, Val Loss: 0.1835, LR: 0.001000
2025-11-28 22:57:23,312 - INFO - Epoch 34/100 - Train Loss: 0.2049, Val Loss: 0.1925, LR: 0.001000
2025-11-28 22:57:32,993 - INFO - Epoch 35/100 - Train Loss: 0.2034, Val Loss: 0.2172, LR: 0.001000
2025-11-28 22:57:42,679 - INFO - Epoch 36/100 - Train Loss: 0.1997, Val Loss: 0.1734, LR: 0.001000
2025-11-28 22:57:52,406 - INFO - Epoch 37/100 - Train Loss: 0.2053, Val Loss: 0.1848, LR: 0.001000
2025-11-28 22:58:02,179 - INFO - Epoch 38/100 - Train Loss: 0.2079, Val Loss: 0.1697, LR: 0.001000
2025-11-28 22:58:12,005 - INFO - Epoch 39/100 - Train Loss: 0.1960, Val Loss: 0.2153, LR: 0.001000
2025-11-28 22:58:21,760 - INFO - Epoch 40/100 - Train Loss: 0.2023, Val Loss: 0.1710, LR: 0.001000
2025-11-28 22:58:31,650 - INFO - Epoch 41/100 - Train Loss: 0.1953, Val Loss: 0.1943, LR: 0.001000
2025-11-28 22:58:41,370 - INFO - Epoch 42/100 - Train Loss: 0.1979, Val Loss: 0.1793, LR: 0.001000
2025-11-28 22:58:51,117 - INFO - Epoch 43/100 - Train Loss: 0.1986, Val Loss: 0.1739, LR: 0.001000
2025-11-28 22:59:00,842 - INFO - Epoch 44/100 - Train Loss: 0.2015, Val Loss: 0.1983, LR: 0.001000
2025-11-28 22:59:10,616 - INFO - Epoch 45/100 - Train Loss: 0.1967, Val Loss: 0.1820, LR: 0.001000
2025-11-28 22:59:20,328 - INFO - Epoch 46/100 - Train Loss: 0.1983, Val Loss: 0.1760, LR: 0.001000
2025-11-28 22:59:30,143 - INFO - Epoch 47/100 - Train Loss: 0.1960, Val Loss: 0.1817, LR: 0.001000
2025-11-28 22:59:39,938 - INFO - Epoch 48/100 - Train Loss: 0.2007, Val Loss: 0.1777, LR: 0.001000
2025-11-28 22:59:49,748 - INFO - Epoch 49/100 - Train Loss: 0.2068, Val Loss: 0.1738, LR: 0.001000
2025-11-28 22:59:59,545 - INFO - Epoch 50/100 - Train Loss: 0.1964, Val Loss: 0.2116, LR: 0.000100
2025-11-28 23:00:09,313 - INFO - Epoch 51/100 - Train Loss: 0.1852, Val Loss: 0.1658, LR: 0.000100
2025-11-28 23:00:19,097 - INFO - Epoch 52/100 - Train Loss: 0.1853, Val Loss: 0.1753, LR: 0.000100
2025-11-28 23:00:29,106 - INFO - Epoch 53/100 - Train Loss: 0.1779, Val Loss: 0.1793, LR: 0.000100
2025-11-28 23:00:38,953 - INFO - Epoch 54/100 - Train Loss: 0.1859, Val Loss: 0.1798, LR: 0.000100
2025-11-28 23:00:48,696 - INFO - Epoch 55/100 - Train Loss: 0.1781, Val Loss: 0.1793, LR: 0.000100
2025-11-28 23:00:58,379 - INFO - Epoch 56/100 - Train Loss: 0.1826, Val Loss: 0.1699, LR: 0.000100
2025-11-28 23:01:08,178 - INFO - Epoch 57/100 - Train Loss: 0.1820, Val Loss: 0.1713, LR: 0.000100
2025-11-28 23:01:18,013 - INFO - Epoch 58/100 - Train Loss: 0.1819, Val Loss: 0.1776, LR: 0.000100
2025-11-28 23:01:27,847 - INFO - Epoch 59/100 - Train Loss: 0.1820, Val Loss: 0.1706, LR: 0.000100
2025-11-28 23:01:37,631 - INFO - Epoch 60/100 - Train Loss: 0.1826, Val Loss: 0.1743, LR: 0.000100
2025-11-28 23:01:47,394 - INFO - Epoch 61/100 - Train Loss: 0.1763, Val Loss: 0.1783, LR: 0.000100
2025-11-28 23:01:57,138 - INFO - Epoch 62/100 - Train Loss: 0.1819, Val Loss: 0.1743, LR: 0.000100
2025-11-28 23:02:06,833 - INFO - Epoch 63/100 - Train Loss: 0.1789, Val Loss: 0.1754, LR: 0.000100
2025-11-28 23:02:16,565 - INFO - Epoch 64/100 - Train Loss: 0.1817, Val Loss: 0.1753, LR: 0.000100
2025-11-28 23:02:26,448 - INFO - Epoch 65/100 - Train Loss: 0.1826, Val Loss: 0.1715, LR: 0.000100
2025-11-28 23:02:36,333 - INFO - Epoch 66/100 - Train Loss: 0.1816, Val Loss: 0.1832, LR: 0.000100
2025-11-28 23:02:46,052 - INFO - Epoch 67/100 - Train Loss: 0.1838, Val Loss: 0.1720, LR: 0.000100
2025-11-28 23:02:55,838 - INFO - Epoch 68/100 - Train Loss: 0.1785, Val Loss: 0.1683, LR: 0.000100
2025-11-28 23:03:05,650 - INFO - Epoch 69/100 - Train Loss: 0.1781, Val Loss: 0.1711, LR: 0.000100
2025-11-28 23:03:15,417 - INFO - Epoch 70/100 - Train Loss: 0.1780, Val Loss: 0.1772, LR: 0.000100
2025-11-28 23:03:25,137 - INFO - Epoch 71/100 - Train Loss: 0.1791, Val Loss: 0.1735, LR: 0.000100
2025-11-28 23:03:34,811 - INFO - Epoch 72/100 - Train Loss: 0.1744, Val Loss: 0.1733, LR: 0.000100
2025-11-28 23:03:44,593 - INFO - Epoch 73/100 - Train Loss: 0.1736, Val Loss: 0.1814, LR: 0.000100
2025-11-28 23:03:54,269 - INFO - Epoch 74/100 - Train Loss: 0.1791, Val Loss: 0.1841, LR: 0.000100
2025-11-28 23:04:04,064 - INFO - Epoch 75/100 - Train Loss: 0.1768, Val Loss: 0.1782, LR: 0.000100
2025-11-28 23:04:13,809 - INFO - Epoch 76/100 - Train Loss: 0.1785, Val Loss: 0.1751, LR: 0.000100
2025-11-28 23:04:23,556 - INFO - Epoch 77/100 - Train Loss: 0.1766, Val Loss: 0.1809, LR: 0.000100
2025-11-28 23:04:33,352 - INFO - Epoch 78/100 - Train Loss: 0.1775, Val Loss: 0.1701, LR: 0.000100
2025-11-28 23:04:43,244 - INFO - Epoch 79/100 - Train Loss: 0.1769, Val Loss: 0.1824, LR: 0.000100
2025-11-28 23:04:53,877 - INFO - Epoch 80/100 - Train Loss: 0.1769, Val Loss: 0.1708, LR: 0.000100
2025-11-28 23:05:03,704 - INFO - Epoch 81/100 - Train Loss: 0.1735, Val Loss: 0.1689, LR: 0.000100
2025-11-28 23:05:13,497 - INFO - Epoch 82/100 - Train Loss: 0.1735, Val Loss: 0.1868, LR: 0.000100
2025-11-28 23:05:23,262 - INFO - Epoch 83/100 - Train Loss: 0.1802, Val Loss: 0.1735, LR: 0.000100
2025-11-28 23:05:33,077 - INFO - Epoch 84/100 - Train Loss: 0.1762, Val Loss: 0.1640, LR: 0.000100
2025-11-28 23:05:33,102 - INFO - New best model saved! Val Loss: 0.1640
2025-11-28 23:05:42,807 - INFO - Epoch 85/100 - Train Loss: 0.1792, Val Loss: 0.1718, LR: 0.000100
2025-11-28 23:05:52,538 - INFO - Epoch 86/100 - Train Loss: 0.1790, Val Loss: 0.1679, LR: 0.000100
2025-11-28 23:06:02,265 - INFO - Epoch 87/100 - Train Loss: 0.1777, Val Loss: 0.1813, LR: 0.000100
2025-11-28 23:06:12,046 - INFO - Epoch 88/100 - Train Loss: 0.1775, Val Loss: 0.1735, LR: 0.000100
2025-11-28 23:06:21,833 - INFO - Epoch 89/100 - Train Loss: 0.1736, Val Loss: 0.1744, LR: 0.000100
2025-11-28 23:06:31,775 - INFO - Epoch 90/100 - Train Loss: 0.1742, Val Loss: 0.1648, LR: 0.000100
2025-11-28 23:06:41,787 - INFO - Epoch 91/100 - Train Loss: 0.1731, Val Loss: 0.1768, LR: 0.000100
2025-11-28 23:06:52,026 - INFO - Epoch 92/100 - Train Loss: 0.1744, Val Loss: 0.1719, LR: 0.000100
2025-11-28 23:07:01,812 - INFO - Epoch 93/100 - Train Loss: 0.1724, Val Loss: 0.1706, LR: 0.000100
2025-11-28 23:07:11,615 - INFO - Epoch 94/100 - Train Loss: 0.1774, Val Loss: 0.1968, LR: 0.000100
2025-11-28 23:07:21,428 - INFO - Epoch 95/100 - Train Loss: 0.1763, Val Loss: 0.1668, LR: 0.000100
2025-11-28 23:07:31,177 - INFO - Epoch 96/100 - Train Loss: 0.1762, Val Loss: 0.1780, LR: 0.000100
2025-11-28 23:07:40,967 - INFO - Epoch 97/100 - Train Loss: 0.1791, Val Loss: 0.1802, LR: 0.000100
2025-11-28 23:07:50,680 - INFO - Epoch 98/100 - Train Loss: 0.1724, Val Loss: 0.1797, LR: 0.000100
2025-11-28 23:08:00,464 - INFO - Epoch 99/100 - Train Loss: 0.1737, Val Loss: 0.1699, LR: 0.000100
2025-11-28 23:08:10,218 - INFO - Epoch 100/100 - Train Loss: 0.1681, Val Loss: 0.1711, LR: 0.000010
2025-11-28 23:08:10,249 - INFO - Training history saved to /home/yajat/Documents/DIP/Deep-Retinex-Decomposition-Extension/checkpoints/training_history.json
2025-11-28 23:08:10,249 - INFO - ==================================================
2025-11-28 23:08:10,249 - INFO - Training completed!
2025-11-28 23:08:10,249 - INFO - Best validation loss: 0.1640
2025-11-28 23:08:10,249 - INFO - Final model saved to /home/yajat/Documents/DIP/Deep-Retinex-Decomposition-Extension/checkpoints/retinexnet_final.pt
2025-11-28 23:08:10,249 - INFO - ==================================================
